0,tweet text
1020,perfect weather natur disast thnk came earli
1021,ahhh weather
1022,wish girlfriend thi perfect weather nake
1023,good dreari raini foggi drizzli misti stormi morn everyon
1024,even weather # thunder
1025,right despit feel gon na play some sand volleybal enjoy weather with besti more vote # teammusso
1026,rhode island beauti sunni
1027,# weather feel humid southeast wind
1028,noth better then woman warm weather # yeahiamthattyp
1029,check thi shit cont
1030,cold outsid
1031,vintag linen item snowi white great shandraslinen
1032,# weather feel humid south wind
1033,break larg wedg tornado ground come into okla citi live weather blog
1034,weather chanel cameraman turn away from recoveri bodi live after tornado slam joplin missouri msnbc
1035,guess anoth sever # thunderstorm head toward
1036,
1037,wan na someth want caught storm tonight think just stay home
1038,prayer go joplin missouri everyon affect thi crazi weather
1039,calm after storm redgag
1040,good morn sunni pick then wilton hous near salisburi think
1041,just snow white work ladi foot locker look serious fairest mall
1042,move your hail storm your fix might fixabl # preparenow
1043,outsid look window them bother anim
1044,commun blood center media blood drive tue noon westridg mall penney lower level blood help joplin
