0,tweet text
504,kilomet min felt great amaz weather good short minu propel drink boug
505,bring sunshin bring good time # summer
506,last night awesom weather beauti good mood high rest weekend which
507,footbal spark twitter storm twitter user have react footbal find put
508,discount herm handbag onlin sale newest style includ check
509,thi windi weather go turn # canola fast keep close plan swath push # okanola
510,yummay weather with some yummi oyster
511,thi weather make veri happi
512,happi monday strive overcom grey doldrum here rise over icki weather suppos rain whole week here
513,thi weekend raini day term have anyth class
514,chilli chili chile chilli chili mirchi chilli pepper paprika
515,damn goin rain next week where weather
516,whisnant just said state economist gotten budget incom forecast wrong time wrong make feel warm fuzzi
517,tomorrow degre that what fuckin talk
518,just hippi wood play djemb raini sunday afternoon
519,correct weather aw head practic
520,andddd wool degre outsid
521,yall crazi campn with waitn jay cold # seriou
522,# friday weather trubbl thur into
523,million degre
524,# iphon # ipad # app hurricanesoftwar ihurrican with push # weather star
525,thi nice weather sure doe bring best folk
526,good morn holi humid thi thing about move back east from colorado that didn miss face hate
527,sever thunderstorm warn until issu edward kiowa counti with gust hail possibl
528,such awesom today got ta love sunni day
529,press check issu amadeu prospectu newslett # travelag # traveltech
530,need work # plan again
531,these # extremecoupon folk blizzard person want dream just have goodi
532,hit that nake weather
533,freez
534,doin good wait some good weather
535,warm sunni deserv delici gourmet slightli pornograph hotdog from wild dawg
536,special weather statement issu expir buffalo
537,good cold quick just degre # wheresmycoat
538,know what mean go well final have nice weather
539,hater make like bee stinger drop dead # cold
540,mind rain your face like sunshin
541,best warm weather call make plan love have everyday
542,# weather feel humid southwest wind
543,cold # water # hot # cold
544,holi fuck shit just eargasm hard listen cave with approach storm
545,twitt some temp soooooooooo fake
546,damn weather just turn stay sunni
547,water sprinkler damag requir profession cleanup befor atlanta weather make difficult prevent
548,happi chirp bird thi morn confus thought there might sunshin just gloomi what smile about bird
549,phone been ring sinc must sunni again # boutim
550,full blown storm costum storm pretti cool gon na clean room
551,eric wright ruthless terror either parish paralyz caus degre fahrenheit
552,turtl pizza wildflow sunshin grenad your jell cours pontiac tran full puppi
553,sever storm warn mile north windom move north
554,
555,driven david zachari rumley gettin ultra swagg today watch puttin fire
556,snow white holla forgot check harbor court
557,look columbu circl # nyc # rain
558,fuck wear nike fila reebok want some beauti beast snow white lion king shoe lmao # childhoodmemori
559,# childhoodmemori sunni ballin them nigga charl green sumner park
560,weather say that area get storm stay away from window glad bed right under
561,hereee with blow sunshin scotti # americanidol need anoth countri star thank
562,babi keep spot warm lmao thi thunderstorm make wish someon cuddl with
563,more than prize soleil day sunni moment promo enter feelthesoleil rule # sweepstak
564,concern sever thunderstorm watch part cntrl nern swrn
565,hell outsid
566,wrong think never seen snow march
567,just damn outsid
568,today give stranger your smile might onli sunshin see
569,misti cloudi raini even spoil view beauti niagara fall
570,bought salad sunshin store chicken gone bite make sick right
571,caus then cold then then
572,keep your face sunshin can not shadow
573,anyon els just sick tire thi weather
574,most follow usual around talli that where storm
575,what stranger whole over thi back hate weather what about
576,honey tonight first friday crossroad district weather go gorgeou some come
577,greet love snow patrol thi right street hear them here
578,cold shake minuit freak
579,bout chase money till sunni sleep money stretch long wall street
580,thi weather depress
581,sundress weather best weather
582,thi must weather channel gone into commerci free mode
583,time sign sever weather text follow facebook
584,antonio texa weather overcast from antonio texa weather
585,knew like sunshin your morn pencil your paper eyelid your
586,# weather feel humid south wind
587,datelin elkhart lake cloudi chilli rain forecast perfect manic depress test race much
588,mom go tonight with date lmao
589,head outsid enjoy thi weather much befor rain inevit return
590,video weather updat includ tornado watch detail
591,nice abl wear skirt walk outsid sunshin without feel cold love # summer
592,mann weather talkin bout
593,onli thing move foward focu futur hard seem onli better storm last forev
594,plant strawberri enjoy sunshin
595,love thi weather
596,hope morn jacksonvil weather hell degre
597,could serious listen long thi storm scare
598,morn sunshin partli sunni
599,just windi post becaus tree build
600,insaneee weather over here
601,winston plan pool parti sinc hell outsid
602,# tropicalstorm # philippin # jtwc atcf track tropic storm aer # aer # bebeng
603,good morn thi beauti sunni morn
604,that have found hard that seat belt buckl could use brand iron # teamfollowback
605,tornado warn central tornado near saginaw move east southeast softbal size hail
606,
607,someth els bear mind # muchado pray good weather
608,love thia storm
609,love window seat # lakelyn when storm roll
610,whoevr patricia patric clark harri tricia mean sound like sunni hostin suck
611,thank hope same more inclin outsid wasn thi alreadi
612,hullo look next snow patrol recommend thi listen
613,fire weather watch issu expir midland odessa
614,# weather feel humid south wind
615,thank awesom birthday wish think might fine sunni spot curl like
616,sever thunderstorm watch statu report statu report
617,
618,
619,
620,# weather feel humid north wind
621,been lazi exam day studi thi weather
622,team with storm victim
623,heard film studi year still rememb weather like public sauna stay cool
624,life much more manag when weather nice
625,have though think have wind burn windi howev tent windbreak guest surviv
626,sweden climat temperatur weather info stormi life
627,here snow treetop what could better
628,bikini weather pictur pictur # bikini # babe
629,sever thunderstorm warn benton carrol madison washington counti until # arwx
630,# cold herr
631,cool raini solut cider
632,outsid
633,chamber commerc weather great week network
634,gon na rain # sanfrancisco need # run today will rest # weather
635,sunni again someth clearli afoot # coffeeup
636,color these # yellow # calcit facet drop make smile sunni # artfir # afpounc
637,jealou just check weather mexico sunni everyday
638,wish wear pant right chilli outsid
639,sister pregnanc until final hold that bundl sunshin
640,check thi song drake
641,
642,
643,
644,learn about onlin master psycholog degre
645,well friend nice come outta woodwork next spam storm
646,quartet snowi owl find home beardsley bridgeport
647,
648,
649,
650,
651,
652,what go with everyon thi raini gloomi just get readi groceri store
653,degre raini guess there cookout
654,they goin thi storm riskin life just caus afford miss class
655,# weather feel humid southeast wind
656,mostli sunni today high
657,sunshin lucki
658,still windi here vega miss
659,superstar feat stuey rock thunderstorm superstar
660,mayb spring humid bone expand
661,next time pari weather allow have picnic
662,sunshin inspir salut thi thank faber flourish yoga wellb back again
663,like outfit wife pick littl chilli never that again # red
664,well went freez ocean love everi second ittt
665,lluvia rain observemo tiempo weather watcher
666,move alreadi such unpleas activ sorri about weather
667,mango snow twist snow
668,amazingli outsid that mean time pool thank good look good piec
669,raini such letdown after last week weather good move into bigger bedroom though
670,# ncwx condit durham current condit
671,
672,
673,fair butler counti automat weather observ report
674,believ variou degre hatr paranoia abandon
675,gon na degre tuesday wednesday
676,blog anoth anoth round thunderstorm
677,today weather dream chocol thank carri some local favorit
678,recommend check snow plow younginz
679,windi here
680,dawn send some your warm weather here brrrrr hope have monday dawnrachel
681,need long some sunshin
682,weather alert that usual
683,shelter keep close watch weather hug
684,humid must such unorthodox thing hair
685,five month after storm kill sago palm just realiz that they pot could have move them insid # dumbass
686,news about warm weather there seem more assault crime
687,snow where heck
688,# weather feel humid south wind
689,weather channel local just said sunni
690,couldn better forecast
691,get lobster snow crab leg lobster tail shrimp cheddar biscuit need extra workout burn cal
692,insomnia thunderstorm kept night much
693,today been pretti good smooth good weather make wan na
694,well blake surviv weather with thi thi tough posit # thevoic
695,sunshin make happi
696,cold outsid wear sandal
697,check thi pretti carter jone good weed white wine
698,left last nite woke freezzzinnggg rememb putn degre
699,sound delight wait stroll beach brain storm
700,excit thi weekend sunshin beach golf life good
701,book lemonad degre weather # perfect
702,press bibl studi thi weather truli # sacrific
703,guess move weather fuck plan onc again
704,today astonishingli beauti warm breez cool there just enough humid make your
705,sound like weather great thi weekend surpris that never sure thing point # justsayin # chicago
706,word street go snow later today
707,# weather feel humid east wind
708,sit deepsea world with mix slush puppi scone
709,brought sunshin from also brought traffic # smugglerstour
710,been rain that what michigan weather
711,share optim about warmer weather storm look quit impress radar
712,quick befor weather start
713,clearli sunshin steadi walk thru rain boosi
714,time celebr bday with some birthday cake yogurt degre
715,hang around noth els frown raini day # monday alway down carpent
716,# teamyabaleft where storm onli work insid rain
717,veri cool photo storm roll progress
718,# weather feel humid northwest wind
719,hope thi rain turn into thunderstorm wait window
720,snow patrol great get samey thi what think
721,goodi final warm enough neighborhood banshe street cryin about turn
722,# listen sunni black let
723,when will again degre radio preciou moment lyric raini afternoon # preciousmo
724,love weather week start turn today just weird
725,dirt arriv with more ralli mode snowi sky
726,# newmus sunni black let # twitraxtuesday
727,degre almost wisconsin hate
728,retir subdu tri storm cockpit say attack seem plan retir mateo polic
729,check video shit song crazi trust
730,sound like littl sunni rose heaven
731,valley center area under sever thunderstorm watch until
732,check littl storm that just pop radar south track
733,outsid wait freez worth
734,# weather feel humid southeast wind
735,done with rain head beach tomorrow final sunshin sand
736,roll video will shot until weather warm watch fan driver crew winter coat enjoy
737,weather gloomi cold
738,first last time walk class friday cornel thank snow # itsmay
739,ride # heatwav wheel melt # teamheat
740,freez boston how weather provid
741,wear thi dress freez thi airport damn
742,long night more weather come pleas limit travel listen warn siren alert radio
743,oper heatwav survey area center around fitzhugh live
744,after cold raini week ohio friday saturday have been beauti outsid
745,video midday weather
746,eewwww member when threw pink snow
747,tatum temp dewpt wind rain # weather
748,wrong around great gammer great pretti much everi game weather
749,help # joplin salvat armi provid emerg relief servic text word joplin make
750,humid could make temp feel like today
751,sever weather delay white ranger
752,# bestdogev crummi weather perfect chill with girl
753,laugh run fresh snow boulder got ta here trail awesom
754,jeri here your cute stori anchor save duckl from storm drain
755,check thi video john stewart chilli wind turf
756,freez
757,celebr homi graduat degre woman # motiv
758,thi weekend onli free ship with coupon code sunshin pass # etsi
759,like swim when cold outsid
760,# weather feel humid southeast wind
761,vote vote vote vote vote jamz sunni
762,tsunami warn weather radio
763,enjoy last night love weather salento wine cafe rice villag area south american inspir great wine select approv
764,jyeah brah brah name nigga alreadi snow
765,friend mine name judi famili rout right thru path storm prayer
766,wish sunni florida watch oriol thi seri # leggo
767,sunni love
768,brother told came tank freez
769,sport alright weather shit
770,sonic lemonberri slush pure # amazing
771,cloudi
772,weather shitti summer need come
773,yello love snow patrol thi right street love thi song
774,everybodi betta outsid enjoy thi good weather sure gone short live
775,visit # nowplay long fall malibu storm
776,hmmmm voic still crap thank thi cold think might audio tweet just anyon interest hear
777,take town storm expect noth less better readi visit
778,bitch outsid
779,gosh outsid
780,
781,take care bypass univers collid sunshin rainbow be unearth construct
782,sunshin link fatherhood parent page parent famili
783,damn well glad storm went right pass here
784,realli turn alway grunt dure that danc move louder diff perf realli loud like ughhahh
785,wojo just know while freez your michigan sweat mine
786,cold weather taylor swift play suddenli sleepi zzzzz
787,scatter thunderstorm develop across west texa southeast mexico will capabl produc light
788,sever thunderstorm watch statu report
789,burr cold today definit look forward sit outsid track meet # cold # ithoughtitwassumm
790,love gon na take austin storm # bestfriend
791,listen befor make miss sophomor year exchang that summer were storm chaser
792,think need anoth coat howev weather there exboyf say mayhap
793,sit front porch drink coffe watch sophi sing danc thi beauti texa weather # perfectmorn
794,weather chill balloon stamped
795,manni doesn want test weather
796,sonic orang slush
797,sunshin continu throughout western york
798,# cltnew wbtv new weather sport traffic charlott aptargroup wbtv
799,vietnames coffe thi sunni noon
800,# nowplay black blue miik snow
801,damn even when work degre engin
802,church tuscaloosa adopt storm victim famili from rosedal commun
803,some carmen electra aerob stripteas cindi crawford cycl hula hoop snow ball fought some balanc
804,sigma gamma soror
805,
806,
807,
808,houston weather diverticul houston weather
809,
810,
811,
812,
813,thursday keep local moment lack spondo sunni photograph
814,# weather feel humid east wind
815,bieber get knock stone cold femal secur footag awesom
816,health depart implement mosquito control after weather area around your home could ideal
817,ahem love snow patrol have thi band what think
818,readi thi weekend hope weather nice
819,glad nice weather here bike work that bike work just like nice weather
820,partli sunni thi afternoon with isol shower becom more humid tonight warm front approach then pass warm
821,check thi # love watchin came acro dusnt amazingli cute just sayin
822,haha there sever day some reason today seem extra nice weather beauti
823,# weather feel humid north wind
824,# weather feel humid southwest wind
825,love when rain dark gloomi thi just perfect weather singl
826,hail storm andrew
827,live coverag from springfield # joplin # tornado thank
828,what happen with # southeasttoday weather girl leav kay
829,cold raini here boston wish with # krew
830,trace adkin sing raini night georgia damn mean dayum
831,isol thunderstorm thi afternoon high tonight
832,sever thunderstorm warn atchison leavenworth counti until updat need from bryan busbi
833,# weather feel humid north wind
834,fuckin hell gon na rain chilli loui cours like sunni never there again
835,storm chaser lawton thi next week love coffe
836,want cold yucki
837,those keep faith within storm storm never last forev will alway shine again
838,let candl massiv lighten storm isl wight tell lighen where
839,# storm # cloud # twilight
840,
841,
842,have taken look hourli graph weather channel like that option
843,alright snow patrol great get samey thi listen
844,chocol here ridgeland basebal park what from coast thi some crappi cold weather
845,mostli sunni degre saturday perfect weather # preak
846,hello everyon look like rain wish could solid week warm sunni breezi weather sigh # groundhogday
847,lookin like ghetto mess week here lmbooooo
848,hous enjoy nice weather realli upset littl cousin over
849,blog updat what differ between dust devil dust storm # azwx
850,email sesnd thi music from sunni later mixtap # bgn
851,go walk esplanad just becaus sunni
852,mostli sunni thi afternoon high tonight
853,partli cloudi stuart powel field airport humid
854,
855,
856,gardner humid feel like alert current advisori
857,these kid have wore # whew time nake
858,tech state that ticket hold until storm damag repair
859,becaus temperatur degre
860,thunder storm oklahoma citi thunder
861,know that raini day stress when your kid stuck insid desper activ occupi
862,damn alreadi degre make veri happi bring heat
863,just finish copi edit histori ancient britain emerg blink into sunshin first time day
864,still cold outsid work hasn call
865,nation weather servic lower mississippi river forecast center
866,
867,honey chilli thi weekend chrissi
868,nope never chanc head next time thank recommend wish weather better down there
869,hangin corner hangin feller lookim chick
870,sunni dover haha
871,where sunshin
872,well those thunderstorm do yard work were nice
873,droppn storm video tomorrow crazyy black thought
874,free tonight look like weather might side
875,weather better right tonight
876,basebal degre beauti baum stadium play
877,ride storm local hous still sluggish
878,ughhhhhh damn outsid
879,# childhoodmemori race snow after bball game germantown
880,# sunshin
881,# weather feel humid south wind
882,smoke rollin window cold beer sittin consol
883,made fool bring down made your heart melt cold core
884,storm award yeah
885,what sunshin
886,outsid clock night degre # fuckyeahsumm
887,lmao yesssss miss member slip snow tryna lmao
888,check line main stage press
889,raini weekend ahead what will do conni
890,what tell yesterday chanc thunderstorm forecast tomorrow storm forecast week until thursday
891,miss parent pool hang inlaw pool pool hous mother sunni degre
892,siesta beach with beauti sunni
893,powerbomb humid well pleas
894,light rain windi grand island central nebraska region airport wind from north
895,train storm come train leav
896,vata articl windi here everyonn vata through roof
897,thi weather forecast depress
898,degre cloudi love cloudi
899,degre insid outsid need anoth blizzard
900,thi hous beyond cold feel like layin insid freezer pleas turn # freez
901,rockin thi maverick game dirk durant flat cold basketbal court
902,weather god have been listen thi weather love # portland
903,stay late craft storm
904,raini gloomi here angel still have sunscreen becaus everyday rain shine
905,# weather feel humid variabl wind
906,cloth fail pack london weather mistak # manchest
907,fund raiser boyd ranch success although auction short windi wind
908,hannah storm will fuck storm
909,heard weather love there
910,# haveyouseenacoupl snow bunni intrushunn east coast
911,dunno which asshol flunk weather school whatev should need jacket
912,onli person heard that loud thunder storm last night that just
913,hannah storm that sound like comic book charact name
914,that call spring weather
915,earn degre sticker
916,tomato plant grow nice weather garden # weathermanhasagreenthumb
917,weather forecast thi even look fabul stop tonight lpyp rock boat parti columbia
918,there least peopl still left overstock coliseum overstock fan raini night # mlb
919,wish cool enough wear ugg degre weather
920,have kick warm weather play mini golf like kid
921,absolut freez after lunch need warm
922,sever weather dalla caus flight delay divers from ksat local new
923,fair enough thi weekend million thing go like everyon decid celebr good weather thi weekend
924,# werockeachothersworld proud your twitter frank hope have # sunni bright smile
925,humid even thi oklahoma say welcom home
926,sever weather delay player championship
927,hope been sick late fuck weather screw
928,rememb safe around # utflood water they were snow long veri cold
929,weather better decent becaus go through tribe withdraw
930,told interview pretti sunni park some friend went detail
931,storm damag cross wwii share storm stori
932,today weather would # perfect creek fest finger cross
933,what camp much water sunshin dure clear sky star night
934,chilli feet slyli tryna seem cute
935,video blawan get down more summer vibe raini day
936,sever thunderstorm warn remain effect until south central gaston counti
937,summer still chilli willi here
938,say world end today bank becaus know save raini
939,thi cold blow babi like thi
940,argh doe behind have blow straight thi freez
941,thi weekend with chanc storm kendra webcast brand onlin
942,there sunshin when gone
943,ukrain weather forecast spark polit storm
944,ooooh know gone degre that track meet friday full nigga
945,outsid
946,friday afternoon shop sunshin margarita happi
947,fuck outsid go extra deodor
948,think there hint sunshin here have send latt cold muscl have seiz
949,have here blue wait storm eat fabul burger oakley
950,storm joke back greensboro
951,local mail fail when deliveri wrong through rain shine snow sleet mail alway get deliver
952,week from today solar sunday idaho green expo hope sunni amaz
953,montreal weather webcam hubert street plaza canada
954,have been miss semi perf run weather
955,alway nice sunni mother stay raini father
956,sever thunderstorm warn nobl counti until
957,goodi sold mojo moxi poppi follow mojo moxi shoe # winhotsho # contest
958,# weather feel humid north wind
959,# unit state # wisconsin # wisconsin dell # the buttesth nation weather associ press
960,event sever thunderstorm warn from christian coun read more
961,three thing about flight down across seat just fine freez thi
962,drive care hope storm doesn good long power stay
963,weather expect realiti
964,rhode island sunshin beauti dark grey sky shit ugli
965,sever thunderstorm warn allen wert counti until # ohwx
966,scatter thunderstorm thi afternoon high tonight
967,nation storm report here observ tornado report today
968,dress weather again
969,flash # flood warn effect part long island tstorm # sne # weather # nyc
970,# happymonday sweet coolin just work tryin stay warm thi bama weather skidzo what doin
971,when uneduc refer diploma degre worri
972,everi that think about wash turn weather suppos rain like legit everi singl time
973,realli hope weather forecast thi weekend come blue ski
974,noth like siren go area sens immediaci weather report least worst pass north
975,post edit cross technolog weather direct internet power wireless forecast
976,realli outsid
977,busi world sketch raini day
978,event sever thunderstorm warn from woodward count read more
979,doe snow idaho utah colorado mexico decemb
980,morn start with some patchi isol shower storm possibl later mani yesterday
981,weather keep indoor today join worship thi weekend saturday sunday
982,just inform sister that canuck fan stole green from alway sunni philli surpris more know
983,satweath weather satweath devic universalcategori weatherpric version itun descript
984,
985,mayb your exemplari custom servic from googl tie into hell freez over
986,bone chill cold outsid
987,fals friend like shadow keep close while walk sunshin leav instant
988,weather been fork late # twilight edward cullen paint with
989,shucker wake forest tonight start fantast weather even patio
990,mind stormi weather better make neighbor alarm night like last night well someth
991,tag applicat blackberri devic book flight clever tool currenc convert weather forecast devic
992,severewarn sever thunderstorm warn benton mill lac sherburn counti until # mnwx
993,gon na storm
994,dear perfect weather thank vest lunch hour time ladi bird lake trail other
995,weather trash
996,beauti weather town go grab pizano with rockin
997,snow money
998,that effect hope haha hate that snow look gorgeou that head with cloth haha
999,anoth raini blah
1000,happi birthday plan take care thi whole raini cloudi thing right parti rain with
1001,readi thi flight back later mammoth kinda bum snow season over gon na
1002,sever thunderstorm warn remain effect until northeastern picken northwestern
1003,children dress today weather mommyskil
1004,just play pocket sunshin unknown unknown unknown
1005,weather beauti even bird bump # mnisdop
1006,gone veri quiet here wine mayb everyon gone home earli enjoy sunshin
1007,
1008,sound like gone through some crazi weather
1009,play euchr windi sunburnt outsid tourney drink yoohoo wear zebra print sunglass break thi poker face
1010,plan chang weather time
1011,arsen blow weather amaz neighbor bumpin music into courtyard some babi scream # sunday
1012,shoutout sunshin thi morn # eastsid # tacoma
1013,folk enjoy nice weather rain back friday next day
1014,that about what temp here rather warm yesterday storm cold again
1015,care fair weather atlanta fanbas loyal # falcon # brave # hawk believ bandwagon jump
1016,uqhhh sooooo outsid # texasweath
1017,weather alert flood warn issu expir glasgow
1018,hail just dark cloud pass overhead southern sunni windi
1019,friday even weather beauti last stand offic bitter onli make payday that much sweeter stay hungri
