0,tweet text
1,grill kabob grill last night amaz glad thi weather final here
2,slowest ever weather make even wors
3,fire weather watch issu expir lubbock
4,go lunch earli today weather nice outsid go enjoy # metim somewher pleasant
5,weekend weather caus delay bridg work
6,pass work tonight storm today would nice would great sleep weather mmmm
7,warm weather forecast lift natur futur
8,friday stadium weather gone
9,hate thi weather good movi marathon though xmen
10,tgif biatch here sunni friday regardless rain drama # popularnameregardlessofparticip
11,good crowd wrigley today terribl weather tell that redneck that just call check red crowd game
12,storm onli that which authent your path
13,hous wash cloth thi raini # bore
14,# weather feel humid northwest wind
15,freez cold like alway whoo buddi excit tonight
16,shower thunderstorm move slowli over area area rain with embed thunderstorm will drift slow
17,here feel great
18,softwar queri three link degre articl jame burk link scienc historian which
19,need that warm weather come back
20,want sunshin back pleas come back
21,find delet iwit weather account least delet photo site which view
22,record humid phoenix today
23,thi what seattl like surpris somebodi kill rosi larsen everybodi must surli # thekil # rain
24,ditto should have worn short today hello humid
25,nice here sunni burbank california
26,normal pajama that cold
27,part thi storm system go make across mountain
28,cherri slush
29,# truck outsid
30,wztv weather
31,minchin storm rant anim use adob after effect flash photoshop wacom cintiq
32,from sunni boston weather fine wish were here american grill other
33,wait until tomorrow night that when still aliv tweet storm world end saturday
34,florida hotter outsid colder insid freez desk today
35,bonjour snow patrol great get samey thi what think
36,raini come round sometim just want slow down # coldplay
37,yeah talk these pic river rock oppos storm condit
38,look forward your show tonight salt lake citi weather suppos great hope toss pick
39,just arriv garrett degre go cool night
40,strongest storm cross natcher parkway south masonvil move into northern ohio counti # tristatewx
41,final compet with your weather sunni here chicago today
42,gon na take bath read plan make pasta puttanesca dinner weather make want chipotl chicken chowder
43,detail about person tub check latest site about chemic post
44,thunderstorm light drizzl vicin jacksonvil municip airport wind from south
45,just finish hour bosqu littl windi otherwis beauti about time summer
46,humid today
47,noth say happi cinco mayo like test raini # fail
48,storm safe weather been crazi late
49,super aw here weather moodi
50,walmart snow boot twitcon # sityoassdown badd
51,sever thunderstorm warn issu expir boulder
52,catch fish folk tomorrow wed downtown farmer market weather will great copper river sockey salmon great
53,tornado season realli over sever thunderstorm tornado form long cont
54,just someth realli storm know what dream
55,fuckin
56,after be told pink decad usda say cook pork pink degre next will they admit alien real
57,sunshin park hair scarv make life when stay night
58,# today # cub # giant game been postpon forecast inclement weather poor condit throughout
59,sever thunderstorm warn dakota goodhu rice steel counti until more
60,# weather feel humid north wind
61,cloud shower east sunni elsewher
62,thi kind weather make want swim
63,blog post weather killl golf
64,mmmmmm warm sunni afternoon patio tavern tech center
65,nice sunni
66,raini summer featur # vintag shoe
67,delici have been wait thi degre month joke been be real dirti girl
68,fuck degre muthafuck time half nake
69,honestli sound more like florida weather never been texa compar sunni again
70,hint windi nowher super just
71,thi cold weather readi someon els girlfriend # dontjudgem
72,least snow
73,favorit video keep sunni side june carter cash
74,sunshin
75,monali nice meet super jealou your profil pictur sure beat raini weather
76,what with raini weber
77,think cloudi super cool weather make xtra sleepi
78,live coverag weather delay amgen start until
79,freez wan na cuddl
80,awwww sound alway there need break anyway that fair want nice weather
81,thunderstorm today high
82,yourheart vacat hous nice weather beauti sight noth like thi
83,probabl new anyth blizzard probabl new anyth blizzard submit unknown
84,love fresh current fli warmer weather chill beat were perfect keep
85,winter storm warn snow inch
86,
87,
88,love weather right
89,thi weather keep under cover
90,paid work good hope have lot sunshin enjoy
91,there might some snow mountain live citi snow here
92,degre have outsid short # justcrazi
93,windi reason
94,spend afternoon downtown with famili walk around canal enjoy beauti weather # nomorerain
95,liter piss down sideway rain have noth protect from thi monstrou weather
96,got ta stun been work last month tri bodi xoxo
97,heart summer need snow plow
98,degre separ
99,gari say storm hope subtitl work celebr juic
100,love thunderstorm couldn stay enjoy
101,cold hell outsid they pool kickin
102,check post photo facebook album storm damag
103,would like powerad slush thank finna thi # happyhour flow sonic # yesy
104,horribl morn bring back sunshin
105,thang sunni anderson # sheesh
106,rrrrriiight tellin weather
107,need huge log branch there plenti float yellowston river right # rain # flood # bill
108,new current condit heavi thunderstorm rain temperat # new # greensboro
109,look like storm with wind within minut downtown # joplin
110,skywarn train last night rock certifi storm spot begin
111,palm beach counti commiss cite sunshin concern dump committe local leader
112,# weather feel humid north wind
113,# weather feel humid northwest wind
114,final temp outsid over
115,congrat trend what should trend # watchoutmav there about thunderstorm dalla
116,freez weloveswift
117,monday morn sunshin plan ahead plan week ahead monday morn
118,laugh storm think ignor just innoc
119,walk enjoy sunshin
120,five love snow patrol thi right street have repeat
121,them doin these twitter peopl gettin they doctor degre tryna leav today
122,even when rain fall even when flood stop rise even when storm come wash water
123,think those american nutter must have misinterpret weather forecast # raptur
124,keek love snow patrol have thi band been repeat sinc heard
125,memphi weather bipolar
126,welcom do great except sooo tire thi weather about
127,sunni beauti tulsa right decid spend sometim outsid offic work
128,morn sunshin
129,sunni again time land everi time think about go back portland start
130,degre what
131,didn brian anythng weather segment
132,play baltimorenetradio eddi rabbit love raini night
133,lanc berkman with snow cone dive catch yeah happen
134,accord weather phone everi go muffin
135,miami weather just like charli sheen polar
136,pour sepia coffe wisteria flower dandelion sunshin spill through periwinkl
137,freez butt long sand beach
138,wonder sunni edmond festiv # thelandofperfect
139,wake beauti weather what great will
140,helloooo sunshin
141,room freez cold
142,yeah time hard tell lifestyl then when find like should have known
143,heavi dust storm blanket part chandler good size dust storm blew through east valley blanket
144,# weather feel humid west wind
145,iforhuman extrem weather north america
146,bear river quest peat begin saturday # snow # utah
147,haha kinda though
148,storm pick lean into wind instead turn away from want keep balanc
149,stay safe event sever thunderstorm watch from
150,pretti much addict storm warn right amaz song
151,just caus there # shitstorm colbi make sunshin love
152,love jewelri book from powel much need inspir raini monday
153,great weekend thank sunni weather have insid hour work
154,jeff will miss oprah give shout onli weatherman could forecast # oprah
155,hahaha tell slush gon na next year
156,malibu show leas weather perfect click
157,haha amaz honor program that onli reason want there stand snow
158,free blizzard
159,just head everyon weather crazi everywher just where live thought need clear that
160,weather data humid wind from rain current advisori
161,complain freez room
162,weather put mood
163,hope thi night raini night
164,northern like under weather watch soon detail come
165,about metal storm wasp knife # awesomeweapon
166,unfortun same here sunni sky realli need some rain much depress much rain # pubwrit
167,stop storm just wait with patienc faith until storm pass away rainbow come bright your
168,freez thi stupid
169,unfortun thi wife doesn come with firewood those chilli night
170,relat know from storm spot counti
171,tatum temp dewpt wind rain # weather
172,cinderella snow white sleep beauti gon na pretti tick when they find they marri prin
173,freez cuddl alon
174,# weather feel humid south wind
175,storm hail pleas away catch flight home # ihatestorm
176,milit storm pakistani naval base karachi islamist milit storm naval base
177,watch degre south again enough thi movi
178,moab today went arch nation park wife kid peter after hike definit have come
179,slush explos date with steph # bond
180,sever storm damag southeast wisconsin height sunday sever storm thousand lost power
181,# nmfire # nmwx fire weather watch issu expir albuquerqu
182,hate thi polar weather antonio
183,shhhh just philippin where sunni shitti everyday
184,here hope weather there those toofan coupl week back
185,sever thunderstorm warn choctaw montgomeri webster counti until # mswx
186,polo boot degre weather # fail
187,weather didnt scare away from store tonight
188,dear # sanfrancisco thi weather blow rain thank pleas togeth thank
189,damn thi thunder storm kame where
190,last long storm that nice sunni neck wood
191,hell outsid today citi # decatur
192,will miss hope weather
193,just provacateur petit bootcut hannah wash perfect warmer weather
194,storm flood water repair call nextgen restor expert
195,woke beauti ball come over horizon where thou ball sunshin enjoy have your around
196,follow # glee # herecomestheboom # sunshin
197,sunni here closer
198,know say april shower bring sever thunderstorm
199,world hasn even happen crazi weather from earth chang possibl from
200,listen raini day
201,grate sunni warm weather perfect stroll beach with photo # cannonbeach # getaway
202,bentley storm relat fatal alabama
203,they cheep storm that where your mother look
204,been freez didn wana fool with # lazytweet
205,sunshin nonprofit improv environ special need individu through there sens touch hear smell sight
206,like degre some timbo short with full length leather coat # damsham
207,mari white alway fog even bright sunni
208,nation sever weather alert weatherbug
209,natur sunshin product report first quarter financi result
210,thi weather need that bull shit
211,final like degre take biggest exam year under these condit # stupidhot
212,yeah sick recent probabl weather someth
213,video fever surg heatwav
214,have been busi collect mart gift card give tornado storm victim present
215,watch enter dragon thi raini raini night then sleep
216,could realli some chocol blanket some music window right # rain
217,turn here hotel immedi meteorologist watch around kansa glad nice weather when land here
218,friday sunni awesom chicago happi weekend superfan
219,like brand northwest weather podcast page mark brian record their episod today
220,weather spotter report # tornado move toward joplin missouri
221,actual like # rain onli becaus umbrella cool # zebraprint
222,freez shit thi morn brother roommat left open window smooth
223,gardner humid feel like alert current advisori
224,listen kfor weather channel they report tornado mile wide debri mile around tornado
225,watch knwa skoff clint boon track sever weather benton counti possibl tornado brew
226,they just interrupt emerg weather program with anoth emerg weather warn take ass bath
227,weather suck late hurrican gon na stop from get swag
228,love thi iowa weather that goe from warm sunni raini lighten less than second
229,go sunni degre # boston today that what they said just day rain # enoughisenough
230,feel humid wind gust pressur # weather
231,happi mother enjoy sunshin look forward father
232,head maker fair thi weekend weather suppos nice partli cloudi with small chanc dooooom
233,imma chef imma cook storm morn
234,look like rain ever # weather
235,fine bout thi interview weather there
236,just seen thi toyota commerci think would truck have thru almost degre
237,just turn today kid degre grad school good health real
238,needless scorch still have been back insid quit some time
239,been inform that bell well also time snow white
240,cant believ about weather either take
241,tuesday hourli mari counti
242,
243,
244,
245,gosh scanner activ thi morn everyon misbehav becaus sunni weather went away
246,sever thunderstorm warn camden miller counti until # midmowx
247,what produc pippa perfect posterior find secret plu pic pippa look tight jean
248,huge thunderstorm thi morn rain lot final thunder lightn work texa know have storm
249,just realiz that probli onli person dumb enough tweet imdb info while stuck outsid hail storm
250,learn more about bachelor degre tonight edward sign learn more
251,agre beauti view mine just walk through hill sunshin made nice walk home hope stay
252,also need know degre right stooooopppp
253,turnpik florida turnpik sunshin parkway
254,need some warm cappuccino thi ugli raini eleven
255,# arenafootbal storm
256,sunni sky over librari plaza branch omin sky over downtown siren still ring
257,freez still look rock
258,hope everyon have better weather than here england hope stop rain sometim soon
259,discoveri kid climat cube weather inform station
260,realli what go with thi weather tent tent that question bride right
261,gardner humid feel like alert current advisori
262,congratul will fight until have more degre than shall defeat more week wait # indi
263,katilyn chat movi walk outsid sprint like thunder storm # matur
264,outsid humid wind press rain
265,happi birthday # leesoonkyu sunni
266,rest tonight
267,
268,
269,today just been weird round would blame weather just seem easi
270,windi side still downtown # coloradospr happi hour until
271,oti red make some excel sunni sunday music
272,graduat degre educ
273,buggin onli have shirt shake like stripper # freez
274,room freez
275,have much today weather doesn make better
276,degre sunni yeah go hell
277,cheer # acbw with blue doubl bottl sunshin
278,mother sunshin
279,blaze storm blaze cyclon halftim # stormsocc
280,should went colombia month least they have beauti weather
281,updat flood inform with rain continu
282,where save young girl storm center comfort zone
283,after see that go wash eye with some nice boil bleach thank
284,sever thunderstorm warn lancast counti until # pawx
285,weather geek alert # noaa show nina weaken seattl peep look good summer
286,nice enjoy good weather caus realli mood work
287,anoth amaz southern hemispher weather appropri garment
288,# weather feel humid southeast wind
289,love thi warm weather
290,wan na caribbean wan na bring wan na some sunshin # wannagobw
291,some folk from abov were taken aback your left boot tini leak good thing water abov degre
292,where sunshin think texa call name time move back home
293,wait storm tonight
294,tommorow nice weather that would first week year with good weather everi singl realli # spring
295,thi weather knock everyon
296,wolf grey aint clean thought they were gone shrug know shaq shit come
297,looki here window open inch final get warmer outsid mayb degre about time # whereisspr
298,freak freez thi biiiiiiiiiitch
299,heard told storm church almost cri made think mama
300,weather disrespect thi week
301,playin crawford move # cold
302,listen sunshin anderson type paper # collegeday where been
303,love thi awesom iowa weather suppos tomorrow they record high
304,hors have muscl each allow them rotat their ear degre
305,same here bluegrass could humid though
306,scatter shower thunderstorm possibl vega
307,storm down tree kill twin sister twin sister were were kill when sever storm blew through part
308,suppos today sunshin earli slight chanc shower storm later go aunt hous later
309,storm with quarter size hail make situat joplin even tougher
310,call crazi enjoy cool weather becaus know month degre outsid # memphisheat
311,chef gelman driskil join beer pair duel against chef snow judg hill restaur
312,could good # storm today
313,look like sunshin although think outdoor concert when didn rain bring poncho anyway # rockvillefest
314,weather get again sigh
315,statesvil weather fair ski temp wind rain today
316,beauti thank great weather everyon
317,how them weather hawaii
318,thi took tumblr storm month natur onli just see love
319,special weather statement issu expir central illinoi
320,yeah forgot today kinda weather # allsmil # grate
321,sever thunderstorm warn fulton knox peoria counti until # ilwx
322,thi mornin kid were makin crazi just found them singin sunshin age # myraptureplaylist
323,thi week will mark longest stretch weather sinc februari # happymonday
324,what pictur perfect here coeur alen anyon els enjoy sunshin
325,photo weather forecast # raptur
326,mile min felt good degre start with veri littl wind
327,subway head museum weather perfect bodi much thi week walk start kick
328,sunni
329,look anoth raini week make weak
330,beauti weather bring everi their mama sheesh tell mom feed
331,storm announc today that they have sign tyler thoma jeremi bolling year deal
332,updat recip summer soup perfect weather
333,degre larg bacon cheeseburg work # poorlifechoic
334,softbal open delay weather push depaul indiana
335,# salut go show kid love tuscaloosa were affect storm
336,today weather simpli perfect rowan happi outsid sunblock mother just use oliv
337,reed timmer follow fairview storm right while launch probe into larg tornado
338,smokin that good shit degre yeah said put duke
339,feel humid wind gust pressur # weather
340,thi weather rock like littl switch
341,sever thunderstorm warn cooper petti salin counti until
342,# weather feel humid northeast wind
343,weather gettin pretti still gon na abl come home today
344,# aot that back go play unchart crysi motor storm onlin
345,# weather feel humid west wind
346,# weather feel humid southeast wind
347,hope everyon great weekend just love sundress weather
348,wait patient electr gloriou caith huge sky plenti sunshin
349,# weather feel humid south wind
350,fuck teacher tryna outsid today shit
351,happi birthday weather shitti yeeeesh well atleast smile bright
352,friday fest chilli
353,yeah freez that sunshin fool fooooooooooooooooooooool
354,thi weather some bullshit
355,sunni tomorrow
356,sooooo annoy with these weather tweet live ohio what expect # getoverit
357,wednesday partli sunni slight chanc rain shower morn then slight chanc thunderstorm
358,former homebound student mine die thi morn like sunshin alway posit despit condit
359,weather turn gorgeou
360,anyon think that sunshin pure happi never danc rain
361,doe lindsay lohan hate christma been rehab dash through snow lmmfao
362,nothin like walkin salon with fresh lollipop beauti sunni love
363,haha sunni down here
364,ladi with pink feather extens reason want mine
365,partli sunni ski show mother
366,audibl skip weather nashvil bound
367,prepar worst still pray best with thi storm stuff
368,georgia weather pissin
369,storm outsid bueno
370,weather alert wednesday
371,kid keep use word like fresh sunshin must investig while gone would read post
372,check
373,niggaz degre
374,last full week school summertim sunshin # seeyousoon
375,# storm yeah
376,greaaaat room test freez
377,syria arrest score damascu suburb soldier reportedli storm saqba make sever arrest overnight http
378,feel humid wind gust pressur # weather
379,head provinc siem reap check work local church do commun there
380,
381,today pretti great weather wise thi
382,degre saturday night love
383,activis blizzard quarterli profit sale rise reuter reuter york reuter activis
384,# weather feel humid southwest wind
385,dayum lmao lock hous wait compani come lmao
386,graduat school award more than degre
387,spend thi raini museum # moma # sundayafternoon
388,around detroit weather page
389,day half over still haven seen mother upsid degre outsid
390,gator found jamestown detail plu sport weather
391,weather halt end tie game seattl goduck
392,take lighten over snow thunderstorm
393,high ati alway sunni florida
394,# weather feel humid northeast wind
395,went hobo joe today snow cone
396,# weather feel humid northeast wind
397,great mother weekend weather veri nice
398,help # joplin salvat armi provid emerg relief servic text word joplin make donat # cnn weather
399,what teas yesterday nice weather
400,readi hous here
401,windi here rustl night blow away clutch straw where cosmic wind carri your scent # micropoetri
402,lightn from storm last night spectacular they were predict storm realli
403,thi weather crazi especi while drive mayb ballet will cancel
404,lyric beatz deal your music there with
405,gunmen storm afghan govern build
406,freak about thi final librari damn
407,blog thi week includ outdoor recreat reco good time with thi gorgeou weather
408,death glass sunni mccoskey napa valley mysteri sunni mccloskey napa valley mysteri
409,enjoy midwest weather
410,outsid
411,weather seattl
412,tonight tomorrow partli cloudi low around high around chanc storm # richmond # weather
413,fuck tavi stupid fuck idiot cancel practic befor fuck drive minut fuck storm medina fuck
414,live countri booni like call these thing quit often start warm
415,lemon berri real fruit slush from sonic
416,# weather feel humid southeast wind
417,damn power
418,love profil gorgeou weather
419,tatum temp dewpt wind rain # weather
420,haha wayn snow warm thi morn here have slice cake
421,storm damag budget negoti mani minnesota militari famili face hardship
422,
423,hope colder weather would hasten their demis afraid onli prolong inevit
424,been chat storm # blackberrymesseng with bunch cool peopl
425,thi weather left complet incap function normal person
426,watch system think need sunni life wait love with
427,# weather feel humid east wind
428,stuck overnight that aw been delay blizzard befor flight feel sorri connect
429,fuckin
430,degre take
431,# weather feel humid southeast wind
432,partli cloudi temp pre rain wind windchil # cltwx
433,hate auto lock door lock myself apart freez death outsid shirt
434,get warm them thar hill amador counti foothil shendoah valley plymouth nice sunni warm
435,amen bull defens good blown they just have weather thi storm take lead
436,life about wait storm pass about learn danc rain
437,rememb weather suck thi last regardless feel good just stay relax # chillin
438,soooo cold outsid grrr
439,outsid sleepin cloth
440,degre onli noon just land bout outchea cont
441,sunni weather drive back diego spend long memori weekend hubbi day what make smile today
442,cold here cold outsid
443,green snow love that grinder
444,yello look next snow patrol recommend thi stop play
445,degre
446,put utensil away cover mirror monitor televis stay away from window hide closet storm come
447,snowi white laundromat broadhead monaca
448,check thi joint shit free pass help sista
449,rememb alway play after storm matti stepanek
450,raini kansa citi intern airport other
451,ashley storm were watch dub unfortun whatev
452,popcap blizzard casual game could purchas popcap game sight unseen know get somethin
453,italian toddler left die yahoo new # wtf alert # pullup # get head winter # hotnow
454,right chelsea sure what were go
455,
456,
457,
458,
459,shawde keep cummin offic talkin bout sunshin like want cooki bitch
460,shit go down fuck outsid
461,sunni marin counti right thank
462,think have some snow although final spring thi week
463,# weather feel humid variabl wind
464,storm upon ptsd veteran veteran awar coalit
465,have argument with girlfriend jump sunshin skyway bridg live
466,# weather feel humid south wind
467,cleveland weather blow
468,hous below zero degre time
469,check entir album here then
470,windi
471,feel grwat durham sooo here # deepsouth
472,noth beat cozi raini even with homemad chili cornbread much bourbon thursday night
473,yike sound like know your season # louisvil that crazi stuff like # detroit weather wise
474,ffuck enough hoe time count money damn summer dark sunni
475,weather there
476,couldnt agre more what temp
477,with thi damn bipolar weather
478,wednesday snow shower snow accumul inch high
479,feather storm childhood lost chao
480,vent next toliet guest bathroom provid perfect temp # shittertwit
481,special weather statement issu expir mobil
482,go today first time age weather perfect might also hamburg # dreambig
483,anyon stream video from park resort today look like nice weather
484,exactli weather these rat prowl
485,soup sell golf cart text messag raini outsid geniu
486,need your lovin like sunshin
487,storm thi even anyth like game tonight # royal fcast sorri
488,upload video snow origin song mark gott
489,serious that februari weather
490,five love snow patrol have thi band they go huge
491,bout enjoy thi sunshin
492,special weather statement issu expir lacross
493,seattl sunshin make want book cruis love sail away from seattl when sunni
494,couldn better weather
495,youtub espn draw star storm batter alabama alabama footbal coach nick colleg footbal
496,humid play with match kid forget corduroy # friction
497,weather beyond beauti
498,wowww # detroit ever normal warm weather stuck traffic motherr efferrr
499,goddamn thi weather rain well least back
500,noth like lazi sunday afternoon wait storm roll
501,ohio tornado databas contain report over tornado that have touch down ohio between
502,signific damag from tornado joplin appear window blown hospit live coverag weather
503,improv tweet abil studi time befor hit sunshin thank
